<?xml version="1.0" encoding="ISO-8859-1"?>
<xs:schema xmlns:xs="http://www.w3.org/2001/XMLSchema">
    <xs:element name="Carta">   
        <xs:complexType>
            <xs:sequence>
                <xs:element name="Categoria" minOccurs="1" maxOccurs="unbounded">
                    <xs:complexType>
                        <xs:sequence>
                            <xs:element name="Producto" minOccurs="1" maxOccurs="unbounded">
                                <xs:complexType>
                                    <xs:attribute name="id">
                                        <xs:simpleType>
                                            <xs:restriction base="xs:string">
                                                <xs:pattern value="[A-Z]{2}\d{3}"/>
                                            </xs:restriction>
                                        </xs:simpleType>
                                    </xs:attribute>
                                </xs:complexType>
                            </xs:element>
                        </xs:sequence>
                        <xs:attribute name="nombre" type="xs:string"/>
                    </xs:complexType>
                </xs:element>
            </xs:sequence>
            <xs:attribute name="id">
                <xs:simpleType>
                    <xs:restriction base="xs:string">
                        <xs:pattern value="[A-Z]{2}\d{3}"/>
                    </xs:restriction>
                </xs:simpleType>
            </xs:attribute>
        </xs:complexType>
    </xs:element>
</xs:schema>